{
  "schemaVersion": 2,
  "id": "R-20000101-0001",
  "createdAt": "2000-01-01T00:00:00Z",
  "updatedAt": "2000-01-01T00:00:00Z",
  "revision": 1,
  "createdBy": "manager",
  "updatedBy": "manager",
  "digest": "sha256:0000000000000000000000000000000000000000000000000000000000000000",
  "correlationId": "run-prepare",
  "campaignId": "C-CAMPAIGN",
  "primaryWorkItemId": "W-0001",
  "actorId": "investigator",
  "role": "investigator",
  "status": "prepared",
  "brief": {
    "path": "active/campaign-slug/runs/R-20000101-0001/brief.md",
    "sha256": "sha256:0000000000000000000000000000000000000000000000000000000000000000"
  },
  "contextPack": {
    "path": "active/campaign-slug/runs/R-20000101-0001/context-pack.json",
    "sha256": "sha256:0000000000000000000000000000000000000000000000000000000000000000"
  },
  "files": [],
  "changedProjectPaths": [],
  "findingIds": [],
  "spawnedWorkItemIds": []
}
